{
  "id": "alpha-first-handoff",
  "agent_id": "alpha",
  "session_id": "run-1",
  "expected_latest_revision": null,
  "capsule": {
    "goal": "Verify the project HTTP contract",
    "summary": "Shared project decisions are in mother. Private findings are in alpha.",
    "constraints": ["Keep credentials out of memory"],
    "decisions": ["Use mother for baseline facts and alpha for private observations"],
    "open_tasks": ["Review run/findings before publishing to the mother base"],
    "next_action": "Recall alpha/run/findings and continue verification"
  },
  "references": []
}
